Bluetooth monitor ver 5.72
btmon[1384]: = Note: Linux version 6.6.86 (mips)                       0.989438
btmon[1384]: = Note: Bluetooth subsystem version 2.22                  0.989460
= New Index: 00:13:37:BC:8F:94 (Primary,USB,hci0)               [hci0] 0.989466
= Open Index: 00:13:37:BC:8F:94                                 [hci0] 0.989469
= Index Info: 00:13:37:BC:8F:94 (MediaTek, Inc.)                [hci0] 0.989472
bluetoothd[2941]: @ MGMT Open: b.. (privileged) version 1.22  {0x0001} 0.989480
hcitool[1388]: @ RAW Open: hcitool (privileged) version 2.22  {0x0002} 1.779337
hcitool[1388]: @ RAW Close: hcitool                           {0x0002} 1.779419
hcitool[1388]: @ RAW Open: hcitool (privileged) version 2.22  {0x0002} 1.779495
hcitool[1388]: @ RAW Close: hcitool                           {0x0002} 1.779512
hcitool[1388]: @ RAW Open.. (privileged) version 2.22  {0x0002} [hci0] 1.779581
hcitool[1388]: < HCI Command: LE Set.. (0x08|0x000b) plen 7  #1 [hci0] 1.779735
        Type: Active (0x01)
        Interval: 10.000 msec (0x0010)
        Window: 10.000 msec (0x0010)
        Own address type: Public (0x00)
        Filter policy: Accept all advertisement (0x00)
> HCI Event: Command Complete (0x0e) plen 4                  #2 [hci0] 1.782032
      LE Set Scan Parameters (0x08|0x000b) ncmd 1
        Status: Success (0x00)
hcitool[1388]: < HCI Command: LE Set.. (0x08|0x000c) plen 2  #3 [hci0] 1.782440
        Scanning: Enabled (0x01)
        Filter duplicates: Disabled (0x00)
> HCI Event: Command Complete (0x0e) plen 4                  #4 [hci0] 1.783395
      LE Set Scan Enable (0x08|0x000c) ncmd 1
        Status: Success (0x00)
> HCI Event: LE Meta Event (0x3e) plen 43                    #5 [hci0] 2.332216
      LE Advertising Report (0x02)
        Num reports: 1
        Event type: Connectable undirected - ADV_IND (0x00)
        Address type: Random (0x01)
        Address: F9:C1:A3:83:F0:48 (Static)
        Data length: 31
        Company: Apple, Inc. (76)
          Type: Unknown (18)
          Data: 206ae0975bb4c91d72511ad8036061fa8397aaa49e280e0346
        RSSI: -96 dBm (0xa0)
> HCI Event: LE Meta Event (0x3e) plen 39                    #6 [hci0] 2.499225
      LE Advertising Report (0x02)
        Num reports: 1
        Event type: Connectable undirected - ADV_IND (0x00)
        Address type: Random (0x01)
        Address: 06:92:D4:30:B1:09 (Non-Resolvable)
        Data length: 27
        Flags: 0x02
          LE General Discoverable Mode
        Service Data: Unknown (0xfcf1)
          Data: 04c0e9c6dda3ee2bd6f63b8d0e10d52630d98861
        RSSI: -100 dBm (0x9c)
> HCI Event: LE Meta Event (0x3e) plen 12                    #7 [hci0] 2.499592
      LE Advertising Report (0x02)
        Num reports: 1
        Event type: Scan response - SCAN_RSP (0x04)
        Address type: Random (0x01)
        Address: 06:92:D4:30:B1:09 (Non-Resolvable)
        Data length: 0
        RSSI: -99 dBm (0x9d)
> HCI Event: LE Meta Event (0x3e) plen 39                    #8 [hci0] 2.615343
      LE Advertising Report (0x02)
        Num reports: 1
        Event type: Connectable undirected - ADV_IND (0x00)
        Address type: Random (0x01)
        Address: 06:92:D4:30:B1:09 (Non-Resolvable)
        Data length: 27
        Flags: 0x02
          LE General Discoverable Mode
        Service Data: Unknown (0xfcf1)
          Data: 04c0e9c6dda3ee2bd6f63b8d0e10d52630d98861
        RSSI: -99 dBm (0x9d)
> HCI Event: LE Meta Event (0x3e) plen 39                    #9 [hci0] 2.740869
      LE Advertising Report (0x02)
        Num reports: 1
        Event type: Connectable undirected - ADV_IND (0x00)
        Address type: Random (0x01)
        Address: 06:92:D4:30:B1:09 (Non-Resolvable)
        Data length: 27
        Flags: 0x02
          LE General Discoverable Mode
        Service Data: Unknown (0xfcf1)
          Data: 04c0e9c6dda3ee2bd6f63b8d0e10d52630d98861
        RSSI: -102 dBm (0x9a)
> HCI Event: LE Meta Event (0x3e) plen 39                   #10 [hci0] 2.977091
      LE Advertising Report (0x02)
        Num reports: 1
        Event type: Connectable undirected - ADV_IND (0x00)
        Address type: Random (0x01)
        Address: 06:92:D4:30:B1:09 (Non-Resolvable)
        Data length: 27
        Flags: 0x02
          LE General Discoverable Mode
        Service Data: Unknown (0xfcf1)
          Data: 04c0e9c6dda3ee2bd6f63b8d0e10d52630d98861
        RSSI: -101 dBm (0x9b)
> HCI Event: LE Meta Event (0x3e) plen 33                   #11 [hci0] 3.002211
      LE Advertising Report (0x02)
        Num reports: 1
        Event type: Connectable undirected - ADV_IND (0x00)
        Address type: Random (0x01)
        Address: D4:06:74:62:37:27 (Static)
        Data length: 21
        Flags: 0x06
          LE General Discoverable Mode
          BR/EDR Not Supported
        128-bit Service UUIDs (complete): 1 entry
          Vendor specific
        RSSI: -92 dBm (0xa4)
> HCI Event: LE Meta Event (0x3e) plen 24                   #12 [hci0] 3.002871
      LE Advertising Report (0x02)
        Num reports: 1
        Event type: Scan response - SCAN_RSP (0x04)
        Address type: Random (0x01)
        Address: D4:06:74:62:37:27 (Static)
        Data length: 12
        Name (complete): InfiniTime
        RSSI: -93 dBm (0xa3)
> HCI Event: LE Meta Event (0x3e) plen 33                   #13 [hci0] 3.309602
      LE Advertising Report (0x02)
        Num reports: 1
        Event type: Connectable undirected - ADV_IND (0x00)
        Address type: Public (0x00)
        Address: 80:E1:26:FA:D6:22 (OUI 80-E1-26)
        Data length: 21
        Flags: 0x06
          LE General Discoverable Mode
          BR/EDR Not Supported
        Name (complete): MyFlipper
        16-bit Service UUIDs (partial): 1 entry
          Unknown (0x3082)
        TX power: 0 dBm
        RSSI: -77 dBm (0xb3)
> HCI Event: LE Meta Event (0x3e) plen 12                   #14 [hci0] 3.310210
      LE Advertising Report (0x02)
        Num reports: 1
        Event type: Scan response - SCAN_RSP (0x04)
        Address type: Public (0x00)
        Address: 80:E1:26:FA:D6:22 (OUI 80-E1-26)
        Data length: 0
        RSSI: -77 dBm (0xb3)
> HCI Event: LE Meta Event (0x3e) plen 39                   #15 [hci0] 3.451714
      LE Advertising Report (0x02)
        Num reports: 1
        Event type: Connectable undirected - ADV_IND (0x00)
        Address type: Random (0x01)
        Address: 06:92:D4:30:B1:09 (Non-Resolvable)
        Data length: 27
        Flags: 0x02
          LE General Discoverable Mode
        Service Data: Unknown (0xfcf1)
          Data: 04c0e9c6dda3ee2bd6f63b8d0e10d52630d98861
        RSSI: -99 dBm (0x9d)
> HCI Event: LE Meta Event (0x3e) plen 33                   #16 [hci0] 3.966976
      LE Advertising Report (0x02)
        Num reports: 1
        Event type: Connectable undirected - ADV_IND (0x00)
        Address type: Random (0x01)
        Address: D4:06:74:62:37:27 (Static)
        Data length: 21
        Flags: 0x06
          LE General Discoverable Mode
          BR/EDR Not Supported
        128-bit Service UUIDs (complete): 1 entry
          Vendor specific
        RSSI: -93 dBm (0xa3)
> HCI Event: LE Meta Event (0x3e) plen 24                   #17 [hci0] 3.967500
      LE Advertising Report (0x02)
        Num reports: 1
        Event type: Scan response - SCAN_RSP (0x04)
        Address type: Random (0x01)
        Address: D4:06:74:62:37:27 (Static)
        Data length: 12
        Name (complete): InfiniTime
        RSSI: -92 dBm (0xa4)
> HCI Event: LE Meta Event (0x3e) plen 20                   #18 [hci0] 3.970418
      LE Advertising Report (0x02)
        Num reports: 1
        Event type: Non connectable undirected - ADV_NONCONN_IND (0x03)
        Address type: Random (0x01)
        Address: D3:FC:B3:1C:81:E4 (Static)
        Data length: 8
        Company: Apple, Inc. (76)
          Type: Unknown (18)
          Data: 0002
        RSSI: -98 dBm (0x9e)
> HCI Event: LE Meta Event (0x3e) plen 43                   #19 [hci0] 4.334715
      LE Advertising Report (0x02)
        Num reports: 1
        Event type: Connectable undirected - ADV_IND (0x00)
        Address type: Random (0x01)
        Address: F9:C1:A3:83:F0:48 (Static)
        Data length: 31
        Company: Apple, Inc. (76)
          Type: Unknown (18)
          Data: 206ae0975bb4c91d72511ad8036061fa8397aaa49e280e0346
        RSSI: -96 dBm (0xa0)
> HCI Event: LE Meta Event (0x3e) plen 12                   #20 [hci0] 4.335117
      LE Advertising Report (0x02)
        Num reports: 1
        Event type: Scan response - SCAN_RSP (0x04)
        Address type: Random (0x01)
        Address: F9:C1:A3:83:F0:48 (Static)
        Data length: 0
        RSSI: -97 dBm (0x9f)
> HCI Event: LE Meta Event (0x3e) plen 39                   #21 [hci0] 4.550351
      LE Advertising Report (0x02)
        Num reports: 1
        Event type: Connectable undirected - ADV_IND (0x00)
        Address type: Random (0x01)
        Address: 06:92:D4:30:B1:09 (Non-Resolvable)
        Data length: 27
        Flags: 0x02
          LE General Discoverable Mode
        Service Data: Unknown (0xfcf1)
          Data: 04c0e9c6dda3ee2bd6f63b8d0e10d52630d98861
        RSSI: -100 dBm (0x9c)
> HCI Event: LE Meta Event (0x3e) plen 33                   #22 [hci0] 5.002226
      LE Advertising Report (0x02)
        Num reports: 1
        Event type: Connectable undirected - ADV_IND (0x00)
        Address type: Random (0x01)
        Address: D4:06:74:62:37:27 (Static)
        Data length: 21
        Flags: 0x06
          LE General Discoverable Mode
          BR/EDR Not Supported
        128-bit Service UUIDs (complete): 1 entry
          Vendor specific
        RSSI: -92 dBm (0xa4)
> HCI Event: LE Meta Event (0x3e) plen 24                   #23 [hci0] 5.002890
      LE Advertising Report (0x02)
        Num reports: 1
        Event type: Scan response - SCAN_RSP (0x04)
        Address type: Random (0x01)
        Address: D4:06:74:62:37:27 (Static)
        Data length: 12
        Name (complete): InfiniTime
        RSSI: -92 dBm (0xa4)
> HCI Event: LE Meta Event (0x3e) plen 33                   #24 [hci0] 5.062466
      LE Advertising Report (0x02)
        Num reports: 1
        Event type: Connectable undirected - ADV_IND (0x00)
        Address type: Public (0x00)
        Address: 80:E1:26:FA:D6:22 (OUI 80-E1-26)
        Data length: 21
        Flags: 0x06
          LE General Discoverable Mode
          BR/EDR Not Supported
        Name (complete): MyFlipper
        16-bit Service UUIDs (partial): 1 entry
          Unknown (0x3082)
        TX power: 0 dBm
        RSSI: -86 dBm (0xaa)
> HCI Event: LE Meta Event (0x3e) plen 12                   #25 [hci0] 5.062979
      LE Advertising Report (0x02)
        Num reports: 1
        Event type: Scan response - SCAN_RSP (0x04)
        Address type: Public (0x00)
        Address: 80:E1:26:FA:D6:22 (OUI 80-E1-26)
        Data length: 0
        RSSI: -86 dBm (0xaa)
> HCI Event: LE Meta Event (0x3e) plen 39                   #26 [hci0] 5.267979
      LE Advertising Report (0x02)
        Num reports: 1
        Event type: Connectable undirected - ADV_IND (0x00)
        Address type: Random (0x01)
        Address: 06:92:D4:30:B1:09 (Non-Resolvable)
        Data length: 27
        Flags: 0x02
          LE General Discoverable Mode
        Service Data: Unknown (0xfcf1)
          Data: 04c0e9c6dda3ee2bd6f63b8d0e10d52630d98861
        RSSI: -100 dBm (0x9c)
> HCI Event: LE Meta Event (0x3e) plen 12                   #27 [hci0] 5.268362
      LE Advertising Report (0x02)
        Num reports: 1
        Event type: Scan response - SCAN_RSP (0x04)
        Address type: Random (0x01)
        Address: 06:92:D4:30:B1:09 (Non-Resolvable)
        Data length: 0
        RSSI: -100 dBm (0x9c)
> HCI Event: LE Meta Event (0x3e) plen 39                   #28 [hci0] 5.755492
      LE Advertising Report (0x02)
        Num reports: 1
        Event type: Connectable undirected - ADV_IND (0x00)
        Address type: Random (0x01)
        Address: 06:92:D4:30:B1:09 (Non-Resolvable)
        Data length: 27
        Flags: 0x02
          LE General Discoverable Mode
        Service Data: Unknown (0xfcf1)
          Data: 04c0e9c6dda3ee2bd6f63b8d0e10d52630d98861
        RSSI: -100 dBm (0x9c)
> HCI Event: LE Meta Event (0x3e) plen 20                   #29 [hci0] 5.977724
      LE Advertising Report (0x02)
        Num reports: 1
        Event type: Non connectable undirected - ADV_NONCONN_IND (0x03)
        Address type: Random (0x01)
        Address: D3:FC:B3:1C:81:E4 (Static)
        Data length: 8
        Company: Apple, Inc. (76)
          Type: Unknown (18)
          Data: 0002
        RSSI: -99 dBm (0x9d)
> HCI Event: LE Meta Event (0x3e) plen 33                   #30 [hci0] 6.813418
      LE Advertising Report (0x02)
        Num reports: 1
        Event type: Connectable undirected - ADV_IND (0x00)
        Address type: Public (0x00)
        Address: 80:E1:26:FA:D6:22 (OUI 80-E1-26)
        Data length: 21
        Flags: 0x06
          LE General Discoverable Mode
          BR/EDR Not Supported
        Name (complete): MyFlipper
        16-bit Service UUIDs (partial): 1 entry
          Unknown (0x3082)
        TX power: 0 dBm
        RSSI: -78 dBm (0xb2)
> HCI Event: LE Meta Event (0x3e) plen 12                   #31 [hci0] 6.813864
      LE Advertising Report (0x02)
        Num reports: 1
        Event type: Scan response - SCAN_RSP (0x04)
        Address type: Public (0x00)
        Address: 80:E1:26:FA:D6:22 (OUI 80-E1-26)
        Data length: 0
        RSSI: -78 dBm (0xb2)
> HCI Event: LE Meta Event (0x3e) plen 33                   #32 [hci0] 7.001714
      LE Advertising Report (0x02)
        Num reports: 1
        Event type: Connectable undirected - ADV_IND (0x00)
        Address type: Random (0x01)
        Address: D4:06:74:62:37:27 (Static)
        Data length: 21
        Flags: 0x06
          LE General Discoverable Mode
          BR/EDR Not Supported
        128-bit Service UUIDs (complete): 1 entry
          Vendor specific
        RSSI: -92 dBm (0xa4)
> HCI Event: LE Meta Event (0x3e) plen 24                   #33 [hci0] 7.002396
      LE Advertising Report (0x02)
        Num reports: 1
        Event type: Scan response - SCAN_RSP (0x04)
        Address type: Random (0x01)
        Address: D4:06:74:62:37:27 (Static)
        Data length: 12
        Name (complete): InfiniTime
        RSSI: -93 dBm (0xa3)
> HCI Event: LE Meta Event (0x3e) plen 29                   #34 [hci0] 7.602840
      LE Advertising Report (0x02)
        Num reports: 1
        Event type: Connectable undirected - ADV_IND (0x00)
        Address type: Random (0x01)
        Address: 6C:E3:68:45:20:97 (Resolvable)
        Data length: 17
        Flags: 0x1a
          LE General Discoverable Mode
          Simultaneous LE and BR/EDR (Controller)
          Simultaneous LE and BR/EDR (Host)
        TX power: 12 dBm
        Company: Apple, Inc. (76)
          Type: Unknown (16)
          Data: 361cee46d1
        RSSI: -99 dBm (0x9d)
> HCI Event: LE Meta Event (0x3e) plen 12                   #35 [hci0] 7.603385
      LE Advertising Report (0x02)
        Num reports: 1
        Event type: Scan response - SCAN_RSP (0x04)
        Address type: Random (0x01)
        Address: 6C:E3:68:45:20:97 (Resolvable)
        Data length: 0
        RSSI: -99 dBm (0x9d)
> HCI Event: LE Meta Event (0x3e) plen 33                   #36 [hci0] 8.569210
      LE Advertising Report (0x02)
        Num reports: 1
        Event type: Connectable undirected - ADV_IND (0x00)
        Address type: Public (0x00)
        Address: 80:E1:26:FA:D6:22 (OUI 80-E1-26)
        Data length: 21
        Flags: 0x06
          LE General Discoverable Mode
          BR/EDR Not Supported
        Name (complete): MyFlipper
        16-bit Service UUIDs (partial): 1 entry
          Unknown (0x3082)
        TX power: 0 dBm
        RSSI: -74 dBm (0xb6)
> HCI Event: LE Meta Event (0x3e) plen 12                   #37 [hci0] 8.569758
      LE Advertising Report (0x02)
        Num reports: 1
        Event type: Scan response - SCAN_RSP (0x04)
        Address type: Public (0x00)
        Address: 80:E1:26:FA:D6:22 (OUI 80-E1-26)
        Data length: 0
        RSSI: -75 dBm (0xb5)
> HCI Event: LE Meta Event (0x3e) plen 33                   #38 [hci0] 9.006971
      LE Advertising Report (0x02)
        Num reports: 1
        Event type: Connectable undirected - ADV_IND (0x00)
        Address type: Random (0x01)
        Address: D4:06:74:62:37:27 (Static)
        Data length: 21
        Flags: 0x06
          LE General Discoverable Mode
          BR/EDR Not Supported
        128-bit Service UUIDs (complete): 1 entry
          Vendor specific
        RSSI: -96 dBm (0xa0)
> HCI Event: LE Meta Event (0x3e) plen 24                   #39 [hci0] 9.007742
      LE Advertising Report (0x02)
        Num reports: 1
        Event type: Scan response - SCAN_RSP (0x04)
        Address type: Random (0x01)
        Address: D4:06:74:62:37:27 (Static)
        Data length: 12
        Name (complete): InfiniTime
        RSSI: -95 dBm (0xa1)
> HCI Event: LE Meta Event (0x3e) plen 39                   #40 [hci0] 9.104207
      LE Advertising Report (0x02)
        Num reports: 1
        Event type: Connectable undirected - ADV_IND (0x00)
        Address type: Random (0x01)
        Address: 06:92:D4:30:B1:09 (Non-Resolvable)
        Data length: 27
        Flags: 0x02
          LE General Discoverable Mode
        Service Data: Unknown (0xfcf1)
          Data: 04c0e9c6dda3ee2bd6f63b8d0e10d52630d98861
        RSSI: -101 dBm (0x9b)
> HCI Event: LE Meta Event (0x3e) plen 12                   #41 [hci0] 9.104677
      LE Advertising Report (0x02)
        Num reports: 1
        Event type: Scan response - SCAN_RSP (0x04)
        Address type: Random (0x01)
        Address: 06:92:D4:30:B1:09 (Non-Resolvable)
        Data length: 0
        RSSI: -100 dBm (0x9c)
> HCI Event: LE Meta Event (0x3e) plen 39                   #42 [hci0] 9.932858
      LE Advertising Report (0x02)
        Num reports: 1
        Event type: Connectable undirected - ADV_IND (0x00)
        Address type: Random (0x01)
        Address: 06:92:D4:30:B1:09 (Non-Resolvable)
        Data length: 27
        Flags: 0x02
          LE General Discoverable Mode
        Service Data: Unknown (0xfcf1)
          Data: 04c0e9c6dda3ee2bd6f63b8d0e10d52630d98861
        RSSI: -99 dBm (0x9d)
> HCI Event: LE Meta Event (0x3e) plen 33                   #43 [hci0] 9.965466
      LE Advertising Report (0x02)
        Num reports: 1
        Event type: Connectable undirected - ADV_IND (0x00)
        Address type: Random (0x01)
        Address: D4:06:74:62:37:27 (Static)
        Data length: 21
        Flags: 0x06
          LE General Discoverable Mode
          BR/EDR Not Supported
        128-bit Service UUIDs (complete): 1 entry
          Vendor specific
        RSSI: -93 dBm (0xa3)
> HCI Event: LE Meta Event (0x3e) plen 24                   #44 [hci0] 9.966143
      LE Advertising Report (0x02)
        Num reports: 1
        Event type: Scan response - SCAN_RSP (0x04)
        Address type: Random (0x01)
        Address: D4:06:74:62:37:27 (Static)
        Data length: 12
        Name (complete): InfiniTime
        RSSI: -93 dBm (0xa3)
> HCI Event: LE Meta Event (0x3e) plen 33                  #45 [hci0] 10.326477
      LE Advertising Report (0x02)
        Num reports: 1
        Event type: Connectable undirected - ADV_IND (0x00)
        Address type: Public (0x00)
        Address: 80:E1:26:FA:D6:22 (OUI 80-E1-26)
        Data length: 21
        Flags: 0x06
          LE General Discoverable Mode
          BR/EDR Not Supported
        Name (complete): MyFlipper
        16-bit Service UUIDs (partial): 1 entry
          Unknown (0x3082)
        TX power: 0 dBm
        RSSI: -86 dBm (0xaa)
> HCI Event: LE Meta Event (0x3e) plen 12                  #46 [hci0] 10.326974
      LE Advertising Report (0x02)
        Num reports: 1
        Event type: Scan response - SCAN_RSP (0x04)
        Address type: Public (0x00)
        Address: 80:E1:26:FA:D6:22 (OUI 80-E1-26)
        Data length: 0
        RSSI: -86 dBm (0xaa)
> HCI Event: LE Meta Event (0x3e) plen 29                  #47 [hci0] 10.338746
      LE Advertising Report (0x02)
        Num reports: 1
        Event type: Connectable undirected - ADV_IND (0x00)
        Address type: Random (0x01)
        Address: 6C:E3:68:45:20:97 (Resolvable)
        Data length: 17
        Flags: 0x1a
          LE General Discoverable Mode
          Simultaneous LE and BR/EDR (Controller)
          Simultaneous LE and BR/EDR (Host)
        TX power: 12 dBm
        Company: Apple, Inc. (76)
          Type: Unknown (16)
          Data: 361cee46d1
        RSSI: -99 dBm (0x9d)
> HCI Event: LE Meta Event (0x3e) plen 39                  #48 [hci0] 11.135341
      LE Advertising Report (0x02)
        Num reports: 1
        Event type: Connectable undirected - ADV_IND (0x00)
        Address type: Random (0x01)
        Address: 06:92:D4:30:B1:09 (Non-Resolvable)
        Data length: 27
        Flags: 0x02
          LE General Discoverable Mode
        Service Data: Unknown (0xfcf1)
          Data: 04c0e9c6dda3ee2bd6f63b8d0e10d52630d98861
        RSSI: -99 dBm (0x9d)
> HCI Event: LE Meta Event (0x3e) plen 29                  #49 [hci0] 11.165214
      LE Advertising Report (0x02)
        Num reports: 1
        Event type: Connectable undirected - ADV_IND (0x00)
        Address type: Random (0x01)
        Address: 6C:E3:68:45:20:97 (Resolvable)
        Data length: 17
        Flags: 0x1a
          LE General Discoverable Mode
          Simultaneous LE and BR/EDR (Controller)
          Simultaneous LE and BR/EDR (Host)
        TX power: 12 dBm
        Company: Apple, Inc. (76)
          Type: Unknown (16)
          Data: 361cee46d1
        RSSI: -100 dBm (0x9c)
> HCI Event: LE Meta Event (0x3e) plen 20                  #50 [hci0] 11.546965
      LE Advertising Report (0x02)
        Num reports: 1
        Event type: Non connectable undirected - ADV_NONCONN_IND (0x03)
        Address type: Random (0x01)
        Address: FB:E5:3D:E8:87:19 (Static)
        Data length: 8
        Company: Apple, Inc. (76)
          Type: Unknown (18)
          Data: 0002
        RSSI: -99 dBm (0x9d)
> HCI Event: LE Meta Event (0x3e) plen 39                  #51 [hci0] 11.621729
      LE Advertising Report (0x02)
        Num reports: 1
        Event type: Connectable undirected - ADV_IND (0x00)
        Address type: Random (0x01)
        Address: 06:92:D4:30:B1:09 (Non-Resolvable)
        Data length: 27
        Flags: 0x02
          LE General Discoverable Mode
        Service Data: Unknown (0xfcf1)
          Data: 04c0e9c6dda3ee2bd6f63b8d0e10d52630d98861
        RSSI: -100 dBm (0x9c)
> HCI Event: LE Meta Event (0x3e) plen 12                  #52 [hci0] 11.622098
      LE Advertising Report (0x02)
        Num reports: 1
        Event type: Scan response - SCAN_RSP (0x04)
        Address type: Random (0x01)
        Address: 06:92:D4:30:B1:09 (Non-Resolvable)
        Data length: 0
        RSSI: -100 dBm (0x9c)
> HCI Event: LE Meta Event (0x3e) plen 39                  #53 [hci0] 11.734212
      LE Advertising Report (0x02)
        Num reports: 1
        Event type: Connectable undirected - ADV_IND (0x00)
        Address type: Random (0x01)
        Address: 06:92:D4:30:B1:09 (Non-Resolvable)
        Data length: 27
        Flags: 0x02
          LE General Discoverable Mode
        Service Data: Unknown (0xfcf1)
          Data: 04c0e9c6dda3ee2bd6f63b8d0e10d52630d98861
        RSSI: -100 dBm (0x9c)
> HCI Event: LE Meta Event (0x3e) plen 12                  #54 [hci0] 11.734616
      LE Advertising Report (0x02)
        Num reports: 1
        Event type: Scan response - SCAN_RSP (0x04)
        Address type: Random (0x01)
        Address: 06:92:D4:30:B1:09 (Non-Resolvable)
        Data length: 0
        RSSI: -101 dBm (0x9b)
> HCI Event: LE Meta Event (0x3e) plen 33                  #55 [hci0] 12.082214
      LE Advertising Report (0x02)
        Num reports: 1
        Event type: Connectable undirected - ADV_IND (0x00)
        Address type: Public (0x00)
        Address: 80:E1:26:FA:D6:22 (OUI 80-E1-26)
        Data length: 21
        Flags: 0x06
          LE General Discoverable Mode
          BR/EDR Not Supported
        Name (complete): MyFlipper
        16-bit Service UUIDs (partial): 1 entry
          Unknown (0x3082)
        TX power: 0 dBm
        RSSI: -78 dBm (0xb2)
> HCI Event: LE Meta Event (0x3e) plen 12                  #56 [hci0] 12.082736
      LE Advertising Report (0x02)
        Num reports: 1
        Event type: Scan response - SCAN_RSP (0x04)
        Address type: Public (0x00)
        Address: 80:E1:26:FA:D6:22 (OUI 80-E1-26)
        Data length: 0
        RSSI: -78 dBm (0xb2)
> HCI Event: LE Meta Event (0x3e) plen 43                  #57 [hci0] 12.354103
      LE Advertising Report (0x02)
        Num reports: 1
        Event type: Connectable undirected - ADV_IND (0x00)
        Address type: Random (0x01)
        Address: F9:C1:A3:83:F0:48 (Static)
        Data length: 31
        Company: Apple, Inc. (76)
          Type: Unknown (18)
          Data: 206ae0975bb4c91d72511ad8036061fa8397aaa49e280e0346
        RSSI: -96 dBm (0xa0)
> HCI Event: LE Meta Event (0x3e) plen 12                  #58 [hci0] 12.354608
      LE Advertising Report (0x02)
        Num reports: 1
        Event type: Scan response - SCAN_RSP (0x04)
        Address type: Random (0x01)
        Address: F9:C1:A3:83:F0:48 (Static)
        Data length: 0
        RSSI: -96 dBm (0xa0)
> HCI Event: LE Meta Event (0x3e) plen 39                  #59 [hci0] 12.449241
      LE Advertising Report (0x02)
        Num reports: 1
        Event type: Connectable undirected - ADV_IND (0x00)
        Address type: Random (0x01)
        Address: 06:92:D4:30:B1:09 (Non-Resolvable)
        Data length: 27
        Flags: 0x02
          LE General Discoverable Mode
        Service Data: Unknown (0xfcf1)
          Data: 04c0e9c6dda3ee2bd6f63b8d0e10d52630d98861
        RSSI: -100 dBm (0x9c)
> HCI Event: LE Meta Event (0x3e) plen 39                  #60 [hci0] 12.564093
      LE Advertising Report (0x02)
        Num reports: 1
        Event type: Connectable undirected - ADV_IND (0x00)
        Address type: Random (0x01)
        Address: 06:92:D4:30:B1:09 (Non-Resolvable)
        Data length: 27
        Flags: 0x02
          LE General Discoverable Mode
        Service Data: Unknown (0xfcf1)
          Data: 04c0e9c6dda3ee2bd6f63b8d0e10d52630d98861
        RSSI: -100 dBm (0x9c)
> HCI Event: LE Meta Event (0x3e) plen 29                  #61 [hci0] 12.827986
      LE Advertising Report (0x02)
        Num reports: 1
        Event type: Connectable undirected - ADV_IND (0x00)
        Address type: Random (0x01)
        Address: 6C:E3:68:45:20:97 (Resolvable)
        Data length: 17
        Flags: 0x1a
          LE General Discoverable Mode
          Simultaneous LE and BR/EDR (Controller)
          Simultaneous LE and BR/EDR (Host)
        TX power: 12 dBm
        Company: Apple, Inc. (76)
          Type: Unknown (16)
          Data: 361cee46d1
        RSSI: -99 dBm (0x9d)
> HCI Event: LE Meta Event (0x3e) plen 12                  #62 [hci0] 12.828671
      LE Advertising Report (0x02)
        Num reports: 1
        Event type: Scan response - SCAN_RSP (0x04)
        Address type: Random (0x01)
        Address: 6C:E3:68:45:20:97 (Resolvable)
        Data length: 0
        RSSI: -99 dBm (0x9d)
[1388]: < HCI Command: LE Set Scan.. (0x08|0x000c) plen 2  #63 [hci0] 13.771723
        Scanning: Disabled (0x00)
        Filter duplicates: Disabled (0x00)
> HCI Event: Command Complete (0x0e) plen 4                #64 [hci0] 13.772549
      LE Set Scan Enable (0x08|0x000c) ncmd 1
        Status: Success (0x00)
[1388]: @ RAW Close: hcitool                          {0x0002} [hci0] 13.772874
